{
  "version": 1,
  "name": "TABATA",
  "type": "TABATA",
  "timeCapSec": 230,
  "intervalSec": 30,
  "workSec": 20,
  "restSec": 10,
  "rounds": 8,
  "repScheme": null,
  "blocks": [
    {
      "movement": "air_squat",
      "name": "Air squats",
      "reps": 0,
      "unit": "reps",
      "slot": 0
    },
    {
      "movement": "push_up",
      "name": "Push-ups",
      "reps": 0,
      "unit": "reps",
      "slot": 1
    }
  ]
}
